{
  "$schema": "http://json-schema.org/draft-07/schema#",
  "$comment": "GENERATED by gui/schema-gen/derive_nf_config_schemas.py from config/tsctsf.json + its source (ADR-0425). Do not edit; regenerate.",
  "title": "tsctsf",
  "type": "object",
  "additionalProperties": false,
  "properties": {
    "port": {
      "type": "integer",
      "x-env-override": "TSCTSF_PORT",
      "x-cpp-type": "unsigned short"
    },
    "sbi_bind_address": {
      "type": "string",
      "x-cpp-type": "std::string"
    },
    "advertised_ipv4": {
      "type": "string",
      "x-env-override": "TSCTSF_ADVERTISED_IPV4",
      "x-cpp-type": "std::string"
    },
    "metrics_bind_address": {
      "type": "string",
      "x-env-override": "TSCTSF_METRICS_BIND_ADDRESS",
      "x-cpp-type": "std::string"
    },
    "nrf_base_url": {
      "type": "string",
      "x-env-override": "TSCTSF_NRF_BASE_URL",
      "x-cpp-type": "std::string"
    },
    "udm_base_url": {
      "type": "string",
      "x-env-override": "TSCTSF_UDM_BASE_URL",
      "x-cpp-type": "std::string"
    },
    "bsf_base_url": {
      "type": "string",
      "x-env-override": "TSCTSF_BSF_BASE_URL",
      "x-cpp-type": "std::string"
    },
    "self_base_url": {
      "type": "string",
      "x-env-override": "TSCTSF_SELF_BASE_URL",
      "x-cpp-type": "std::string"
    },
    "oauth2_required": {
      "type": "boolean",
      "x-env-override": "TSCTSF_OAUTH2_REQUIRED",
      "x-cpp-type": "bool"
    }
  },
  "required": [
    "advertised_ipv4",
    "bsf_base_url",
    "metrics_bind_address",
    "nrf_base_url",
    "port",
    "sbi_bind_address",
    "self_base_url",
    "udm_base_url"
  ],
  "x-config-file": "config/tsctsf.json",
  "x-source": [
    "nfs/tsctsf"
  ],
  "x-apply": "restart",
  "x-review": []
}
