{
  "port": 7825,
  "sbi_bind_address": "0.0.0.0",
  "advertised_ipv4": "127.0.0.1",
  "metrics_bind_address": "0.0.0.0:9497",
  "nrf_base_url": "https://127.0.0.1:7777",
  "udm_base_url": "https://127.0.0.1:7780",
  "bsf_base_url": "https://127.0.0.1:7789",
  "self_base_url": "https://127.0.0.1:7825",
  "oauth2_required": true
}
